Sheet: Tabelle1
A1: Pixelfaktor: Pixel pro 1000 Lichtjahre: | B1: 637
A2: L = galaktische Länge (Longitude) | B2: Rechtssystem | C2: Rechtssystem | D2: Rechtssystem
A3: B = galaktische Breite (Latitude) | B3: Nördlichkeit (Söl -> Zentrum) | C3: Höhe über Ebene (Söl -> Ziskö) | D3: Östlichkeit (Söl -> Carina) | E3: Distanz von Söl | F3: Draufsicht: Gradzahl von der x-Achse gegen den Uhrzeigersinn | G3: Gradzahl nach oben von der Ebene weg
A4: Formel | B4: x = D*cos(L) | C4: y = D*sin(B) | D4: z = D*(-1)*sin(L) | H4: BildX = z*(Pixelfaktor/1000) | I4: BildY = (-1)*x*(Pixelfaktor/1000)
A5: Sol-zentrierte Kartenposition von | B5: x (Nördlichkeit) [ly] | C5: y (Höhe) [ly] | D5: z (Östlichkeit) [ly] | E5: Distanz D [ly] | F5: Galaktische Länge L | G5: Galaktische Breite B | H5: Bildposition x (Pixel nach rechts) | I5: Bildposition y (Pixel nach unten)
A6: Söl | B6: 0 | C6: 0 | D6: 0 | E6: 0 | F6: 0 | G6: 0 | H6: of:=[.$D6]*[.$B$1]/1000 -> 0 | I6: of:=(-1)*[.$B6]*[.$B$1]/1000 -> -0
A7: Maia | B7: -349.564 | C7: -143.633 | D7: -86.0511 | E7: 360 | F7: 166.170657 | G7: -23.514517 | H7: of:=[.$D7]*[.$B$1]/1000 -> -54.8145507 | I7: of:=(-1)*[.$B7]*[.$B$1]/1000 -> 222.672268
A8: Elektra | B8: -388.421 | C8: -161.729 | D8: -95.5464 | E8: 400 | F8: 166.18038 | G8: -23.848669 | H8: of:=[.$D8]*[.$B$1]/1000 -> -60.8630568 | I8: of:=(-1)*[.$B8]*[.$B$1]/1000 -> 247.424177
A9: Helixnebel (SOTIs Planet) | B9: 524.783 | C9: -545.866 | D9: -383.54 | E9: 650 | F9: 36.161326 | G9: -57.11837 | H9: of:=[.$D9]*[.$B$1]/1000 -> -244.31498 | I9: of:=(-1)*[.$B9]*[.$B$1]/1000 -> -334.286771
A10: Zöl | B10: 4126.78 | C10: -55.3037 | D10: 1725.31 | E10: 4472.916 | F10: 337.31138 | G10: -0.70843 | H10: of:=[.$D10]*[.$B$1]/1000 -> 1099.02247 | I10: of:=(-1)*[.$B10]*[.$B$1]/1000 -> -2628.75886
A11: NGC 6334 OI-T c3-3 (Katzenpfote) | B11: 5464.59 | C11: 52.375 | D11: 838.699 | E11: 5528.5804 | F11: 351.274398 | G11: 0.5427996 | H11: of:=[.$D11]*[.$B$1]/1000 -> 534.251263 | I11: of:=(-1)*[.$B11]*[.$B$1]/1000 -> -3480.94383
A12: HD 93129 A (Trumpler 14) | B12: 2242.52 | C12: -75.0594 | D12: 7151.65 | E12: 7495 | F12: 287.409648 | G12: -0.573804 | H12: of:=[.$D12]*[.$B$1]/1000 -> 4555.60105 | I12: of:=(-1)*[.$B12]*[.$B$1]/1000 -> -1428.48524
A13: Eta Carinae A (Carinanebel) | B13: 2268.88 | C13: -82.4561 | D13: 7153.82 | E13: 7505 | F13: 287.596781 | G13: -0.629511 | H13: of:=[.$D13]*[.$B$1]/1000 -> 4556.98334 | I13: of:=(-1)*[.$B13]*[.$B$1]/1000 -> -1445.27656
A15: Dönkwön (Ameisenwesen) | B15: nahe Zöl (+- 400) | C15: nahe Zöl (+- 100) | D15: nahe Zöl (+- 400)
A16: Nögnög (Raumstation) | B16: nahe Zöl (+- 400) | C16: nahe Zöl (+- 100) | D16: nahe Zöl (+- 400)
A17: Cäribbeän (Gnörk-Kartell) | B17: nahe Zöl (+- 100) | C17: nahe Zöl (+- 100) | D17: nahe Zöl (+ 600)
A18: Ziskö (Warpfunk-Leuchtturm) | B18: nahe Zöl (+- 50) | C18: 350 | D18: nahe Zöl (+- 50)